{
  "$schema": "https://json-schema.org/draft/2020-12/schema",
  "$id": "https://github.com/MacCracken/ai-hwaccel/schema.json",
  "title": "AcceleratorRegistry",
  "description": "The JSON that ai-hwaccel prints by default (and with --json): detected accelerators, detection warnings and system I/O. schema_version 6. Written by registry_to_json in src/json_out.cyr. The other JSON outputs are under $defs: Summary (--summary), ShardingPlan (--plan), TrainingMemory (--train) and CostReport (--cost --json). Every key in an object is listed; optional keys are omitted, never null, when a value is unknown or does not apply. String values are JSON-escaped (RFC 8259) since 2.5.5: a quote, backslash or control byte in a device name, a tool's output or the --cost argument no longer breaks the document.",
  "type": "object",
  "required": ["schema_version", "profiles", "system_io"],
  "additionalProperties": false,
  "properties": {
    "schema_version": {
      "description": "Bumped whenever the format gains or changes keys. 6 since 2.3.28 (shared_memory_bytes).",
      "const": 6
    },
    "profiles": {
      "description": "One profile per detected device, the CPU first. A device that two backends report is listed once (since 2.4.0).",
      "type": "array",
      "minItems": 1,
      "items": { "$ref": "#/$defs/AcceleratorProfile" }
    },
    "warnings": {
      "description": "Names of the vendor tools that were not found or failed (for example \"nvidia-smi\"), one per attempt. Omitted when there are none.",
      "type": "array",
      "minItems": 1,
      "items": { "type": "string" }
    },
    "system_io": {
      "description": "Interconnects, storage and the runtime environment (since schema v4).",
      "oneOf": [{ "$ref": "#/$defs/SystemIo" }, { "type": "null" }]
    }
  },
  "$defs": {
    "AcceleratorProfile": {
      "description": "One device. profile_from_json (src/json_out.cyr) reads it back: since 2.5.5 a key holding another type than the one below (null, a string, a float) reads as absent, and a value outside the ranges below makes it refuse the profile, as malformed JSON does.",
      "type": "object",
      "required": ["accelerator", "accel_type_id", "device_id", "available", "memory_bytes", "family"],
      "additionalProperties": false,
      "properties": {
        "accelerator": {
          "description": "Display name of the accelerator type. \"Unknown\" only when a consumer re-serializes a profile read back with an accel_type_id this build does not know.",
          "enum": ["CPU", "CUDA GPU", "ROCm GPU", "Metal GPU", "Vulkan GPU", "Intel NPU", "AMD XDNA NPU", "Apple Neural Engine", "TPU", "Intel Gaudi", "AWS Neuron", "Qualcomm Cloud AI 100", "Intel oneAPI GPU", "Cerebras WSE", "Graphcore IPU", "Groq LPU", "Samsung NPU", "MediaTek APU", "Windows GPU", "AGNOS GPU", "Unknown"]
        },
        "accel_type_id": {
          "description": "The accelerator type as a number, the authoritative tag when a profile is read back (profile_from_json). This build writes 0..19; reading back, it keeps a higher id (a newer producer's type) and refuses a negative one.",
          "type": "integer", "minimum": 0, "maximum": 19
        },
        "device_id": { "description": "Index within the backend, at most 1024 (CMD_MAX_DEVICE_ID, the bound every tool parser applies).", "type": "integer", "minimum": 0, "maximum": 1024 },
        "available": { "type": "boolean" },
        "memory_bytes": { "description": "Memory the device can use. For a device on system RAM this includes the shared part below. At most 16 TiB (17592186044416) for an accelerator, the tool parsers' bound, and 1 PiB (1125899906842624) for the CPU profile's system RAM.", "type": "integer", "minimum": 0, "maximum": 1125899906842624 },
        "family": { "description": "\"Unknown\" only for a re-serialized profile whose accel_type_id this build does not know.", "enum": ["CPU", "GPU", "NPU", "TPU", "AI ASIC", "Unknown"] },
        "compute_capability": { "description": "CUDA compute capability (\"8.9\"), or the ROCm gfx target.", "type": "string" },
        "driver_version": { "type": "string" },
        "device_name": { "type": "string" },
        "memory_used_bytes": { "description": "At most memory_bytes' bound for the type.", "type": "integer", "minimum": 0, "maximum": 1125899906842624 },
        "memory_free_bytes": { "description": "At most memory_bytes' bound for the type.", "type": "integer", "minimum": 0, "maximum": 1125899906842624 },
        "numa_node": { "type": "integer", "minimum": 0 },
        "temperature_c": { "type": "integer" },
        "gpu_utilization_percent": { "type": "integer", "minimum": 0, "maximum": 100 },
        "mem_bandwidth_x1000": { "description": "Memory bandwidth, GB/s x 1000.", "type": "integer", "minimum": 0 },
        "pcie_bandwidth_x1000": { "description": "PCIe link bandwidth, GB/s x 1000.", "type": "integer", "minimum": 0 },
        "power_x1000": { "description": "Power draw, watts x 1000.", "type": "integer", "minimum": 0 },
        "tpu_version": { "type": "integer", "minimum": 0 },
        "tpu_chips": { "type": "integer", "minimum": 1, "maximum": 1024 },
        "gaudi_gen": { "type": "integer", "minimum": 0 },
        "neuron_chip": { "type": "integer", "minimum": 0 },
        "neuron_cores": { "type": "integer", "minimum": 1, "maximum": 1024 },
        "shared_memory_bytes": {
          "description": "The part of memory_bytes that is system RAM, which the CPU profile already counts: all of it for Apple Silicon, the client NPUs and integrated GPUs on system RAM; 480 GiB on a GH200. At most memory_bytes. Never on the CPU profile: profile_from_json ignores it there and reads 0 as absent. Absent, the reader derives it from the type (all of memory_bytes on a system-memory type, else none). Since schema v6.",
          "type": "integer", "minimum": 1
        }
      }
    },
    "SystemIo": {
      "type": "object",
      "required": ["interconnects", "storage", "environment"],
      "additionalProperties": false,
      "properties": {
        "interconnects": { "type": "array", "items": { "$ref": "#/$defs/Interconnect" } },
        "storage": { "type": "array", "items": { "$ref": "#/$defs/Storage" } },
        "environment": { "oneOf": [{ "$ref": "#/$defs/RuntimeEnvironment" }, { "type": "null" }] }
      }
    },
    "Interconnect": {
      "type": "object",
      "required": ["kind", "name", "bandwidth_bytes_per_sec", "state"],
      "additionalProperties": false,
      "properties": {
        "kind": { "enum": ["InfiniBand", "RoCE", "RoCE v2", "NVLink", "NVSwitch", "XGMI", "ICI", "PCIe", "Unknown"] },
        "name": { "type": "string" },
        "bandwidth_bytes_per_sec": { "type": "integer", "minimum": 0 },
        "state": { "description": "For InfiniBand and RoCE, the port state number sysfs reports (4 is ACTIVE); 4 for an NVSwitch; 0 when unknown, as for the other kinds.", "type": "integer", "minimum": 0, "maximum": 99 }
      }
    },
    "Storage": {
      "type": "object",
      "required": ["name", "kind", "bandwidth_bytes_per_sec"],
      "additionalProperties": false,
      "properties": {
        "name": { "type": "string" },
        "kind": { "enum": ["NVMe", "SATA SSD", "HDD", "Unknown"] },
        "bandwidth_bytes_per_sec": { "type": "integer", "minimum": 0 }
      }
    },
    "RuntimeEnvironment": {
      "type": "object",
      "required": ["is_docker", "is_k8s"],
      "additionalProperties": false,
      "properties": {
        "is_docker": { "type": "boolean" },
        "is_k8s": { "type": "boolean" },
        "k8s_namespace": { "type": "string" },
        "cloud_provider": { "type": "string" },
        "instance_type": { "type": "string" },
        "region": { "type": "string" },
        "k8s_gpu_count": { "type": "integer", "minimum": 0 },
        "k8s_gpu_source": { "type": "string" }
      }
    },
    "Summary": {
      "description": "ai-hwaccel --summary (registry_to_summary_json). Totals count system RAM once.",
      "type": "object",
      "required": ["device_count", "has_accelerator", "total_memory_bytes", "accelerator_memory_bytes", "gpu_count", "tpu_count", "npu_count", "warnings"],
      "additionalProperties": false,
      "properties": {
        "device_count": { "type": "integer", "minimum": 1 },
        "has_accelerator": { "type": "boolean" },
        "total_memory_bytes": { "type": "integer", "minimum": 0 },
        "accelerator_memory_bytes": { "type": "integer", "minimum": 0 },
        "gpu_count": { "type": "integer", "minimum": 0 },
        "tpu_count": { "type": "integer", "minimum": 0 },
        "npu_count": { "type": "integer", "minimum": 0 },
        "warnings": { "description": "The number of warnings.", "type": "integer", "minimum": 0 }
      }
    },
    "ShardingPlan": {
      "description": "ai-hwaccel --plan <model> [--quant <q>] (plan_to_json).",
      "type": "object",
      "required": ["strategy", "strategy_count", "total_memory_bytes", "fits", "shards"],
      "additionalProperties": false,
      "properties": {
        "strategy": { "enum": ["None", "Pipeline Parallel", "Tensor Parallel", "Data Parallel", "Unknown"] },
        "strategy_count": { "type": "integer", "minimum": 0 },
        "total_memory_bytes": { "type": "integer", "minimum": 0 },
        "fits": { "description": "Whether every shard fits the memory of the device it names. false when nothing holds the model: the CPU fallback ('None' on the CPU) asks for more than the CPU's memory, or no device is available ('Data Parallel', no shards). Added in 2.5.5.", "type": "boolean" },
        "est_tokens_per_sec_x1000": { "description": "Estimated throughput, tokens/s x 1000. Omitted when unknown.", "type": "integer", "minimum": 0 },
        "shards": { "type": "array", "items": { "$ref": "#/$defs/Shard" } }
      }
    },
    "Shard": {
      "type": "object",
      "required": ["id", "layer_start", "layer_end", "device", "device_id", "memory_bytes"],
      "additionalProperties": false,
      "properties": {
        "id": { "type": "integer", "minimum": 0 },
        "layer_start": { "type": "integer", "minimum": 0 },
        "layer_end": { "type": "integer", "minimum": 0 },
        "device": { "$ref": "#/$defs/AcceleratorProfile/properties/accelerator" },
        "device_id": { "type": "integer", "minimum": 0 },
        "memory_bytes": { "type": "integer", "minimum": 0 }
      }
    },
    "TrainingMemory": {
      "description": "ai-hwaccel --train <model> [--method <m>] (training_to_json). Each figure twice: bytes, and GiB x 1000.",
      "type": "object",
      "required": ["model_bytes", "model_gib_x1000", "optimizer_bytes", "optimizer_gib_x1000", "activation_bytes", "activation_gib_x1000", "total_bytes", "total_gib_x1000"],
      "additionalProperties": false,
      "properties": {
        "model_bytes": { "type": "integer", "minimum": 0 },
        "model_gib_x1000": { "type": "integer", "minimum": 0 },
        "optimizer_bytes": { "type": "integer", "minimum": 0 },
        "optimizer_gib_x1000": { "type": "integer", "minimum": 0 },
        "activation_bytes": { "type": "integer", "minimum": 0 },
        "activation_gib_x1000": { "type": "integer", "minimum": 0 },
        "total_bytes": { "type": "integer", "minimum": 0 },
        "total_gib_x1000": { "type": "integer", "minimum": 0 }
      }
    },
    "CostReport": {
      "description": "ai-hwaccel --cost <model> [--quant <q>] --json (cost_to_json in src/cost.cyr).",
      "type": "object",
      "required": ["model", "quantization", "memory_required_bytes", "recommendations"],
      "additionalProperties": false,
      "properties": {
        "model": { "description": "The --cost argument as given, JSON-escaped.", "type": "string" },
        "quantization": { "enum": ["FP32", "FP16", "BF16", "INT8", "INT4", "Unknown"] },
        "memory_required_bytes": { "type": "integer", "minimum": 0 },
        "recommendations": { "type": "array", "items": { "$ref": "#/$defs/CostRecommendation" } }
      }
    },
    "CostRecommendation": {
      "type": "object",
      "required": ["instance", "provider", "gpu", "gpu_count", "total_memory_gb", "price_per_hour_usd_x100"],
      "additionalProperties": false,
      "properties": {
        "instance": { "type": "string" },
        "provider": { "type": "string" },
        "gpu": { "type": "string" },
        "gpu_count": { "type": "integer", "minimum": 0 },
        "total_memory_gb": { "type": "integer", "minimum": 0 },
        "price_per_hour_usd_x100": { "description": "Price per hour, US cents.", "type": "integer", "minimum": 0 }
      }
    }
  }
}
