{"schema_version":6,"profiles":[{"accelerator":"CPU","accel_type_id":0,"device_id":0,"available":true,"memory_bytes":58880188416,"family":"CPU"},{"accelerator":"ROCm GPU","accel_type_id":2,"device_id":0,"available":true,"memory_bytes":8589934592,"family":"GPU","compute_capability":"0xc5","driver_version":"113-CEZANNE-021","device_name":"AMD Radeon (PCI 0x1002:0x1638)","memory_used_bytes":178708480,"memory_free_bytes":8411226112,"temperature_c":44,"gpu_utilization_percent":0,"pcie_bandwidth_x1000":15744,"power_x1000":26000},{"accelerator":"Vulkan GPU","accel_type_id":4,"device_id":0,"available":true,"memory_bytes":4294967296,"family":"GPU","device_name":"AMD Radeon Graphics (RADV RENOIR)"}],"warnings":["nvidia-smi","system_profiler","hl-smi","neuron-ls","xpu-smi","cerebras_cli","gc-info","nvidia-smi"],"system_io":{"interconnects":[],"storage":[{"name":"nvme0n1","kind":"NVMe","bandwidth_bytes_per_sec":3500000000},{"name":"sda","kind":"SATA SSD","bandwidth_bytes_per_sec":550000000}],"environment":null}}
